{
  "type": "object",
  "properties": {
    "ObservabilityConfigurationArn": {
      "type": "string"
    },
    "ObservabilityConfigurationName": {
      "type": "string"
    },
    "ObservabilityConfigurationRevision": {
      "type": "integer"
    },
    "Latest": {
      "type": "boolean"
    },
    "Status": {
      "type": "string",
      "enum": [
        "ACTIVE",
        "INACTIVE"
      ]
    },
    "TraceConfiguration": {
      "type": "object",
      "properties": {
        "Vendor": {
          "type": "string",
          "enum": [
            "AWSXRAY"
          ]
        }
      }
    },
    "CreatedAt": {
      "type": "string",
      "format": "date-time"
    },
    "DeletedAt": {
      "type": "string",
      "format": "date-time"
    }
  },
  "$schema": "https://json-schema.org/draft/2020-12/schema",
  "$id": "https://raw.githubusercontent.com/api-evangelist/aws-app-runner/refs/heads/main/json-schema/app-runner-observability-configuration-schema.json",
  "title": "ObservabilityConfiguration",
  "description": "ObservabilityConfiguration schema from AWS App Runner"
}